[
  {
    "headers": {
      "user-agent": "Bird-Doeasy E700_TD/S100 Linux/3.0.8 Android/4.0.3 Release/03.12.2013 Browser/AppleWebkit534.30 Mobile Safari/534.30;"
    },
    "device": {
      "deviceName": "E700",
      "marketingName": "E700",
      "manufacturer": "bird",
      "brand": "bird",
      "display": {
        "width": 320,
        "height": 240,
        "touch": true,
        "size": null
      },
      "type": "smartphone"
    },
    "browser": {
      "name": "Android Webkit",
      "modus": null,
      "version": "4.0.0",
      "manufacturer": "google",
      "bits": 32,
      "type": "browser"
    },
    "os": {
      "name": "Android",
      "marketingName": "Android",
      "version": "4.0.3",
      "manufacturer": "google",
      "bits": 32
    },
    "engine": {
      "name": "WebKit",
      "version": "534.30.0",
      "manufacturer": "apple"
    }
  },
  {
    "headers": {
      "user-agent": "Bird i600_TD/1.0 Linux/3.0.8 Android/4.0.3 Release/04.20.2013 AppleWebKit/534.30 Version/4.0 Mozilla/5.0 Mobile System/Android 4.0.3;"
    },
    "device": {
      "deviceName": "I600",
      "marketingName": "I600",
      "manufacturer": "bird",
      "brand": "bird",
      "display": {
        "width": 800,
        "height": 480,
        "touch": true,
        "size": null
      },
      "type": "smartphone"
    },
    "browser": {
      "name": "Android Webkit",
      "modus": null,
      "version": "4.0.0",
      "manufacturer": "google",
      "bits": 32,
      "type": "browser"
    },
    "os": {
      "name": "Android",
      "marketingName": "Android",
      "version": "4.0.3",
      "manufacturer": "google",
      "bits": 32
    },
    "engine": {
      "name": "WebKit",
      "version": "534.30.0",
      "manufacturer": "apple"
    }
  },
  {
    "headers": {
      "user-agent": "Mozilla/5.0 (Linux; U; Android 4.2.2; zh-cn; Bird i7 Build/JDQ39) AppleWebKit/534.30 (KHTML, like Gecko) Version/4.0 Mobile Safari/534.30Mopo/1830(4.0.12;1_skymobi_;bd87_89_td_emmc_bird_i7;Bird i7;480*854)"
    },
    "device": {
      "deviceName": "I7",
      "marketingName": "I7",
      "manufacturer": "bird",
      "brand": "bird",
      "display": {
        "width": 854,
        "height": 480,
        "touch": true,
        "size": null
      },
      "type": "smartphone"
    },
    "browser": {
      "name": "Android Webkit",
      "modus": null,
      "version": "4.0.0",
      "manufacturer": "google",
      "bits": 32,
      "type": "browser"
    },
    "os": {
      "name": "Android",
      "marketingName": "Android",
      "version": "4.2.2",
      "manufacturer": "google",
      "bits": 32
    },
    "engine": {
      "name": "WebKit",
      "version": "534.30.0",
      "manufacturer": "apple"
    }
  },
  {
    "headers": {
      "user-agent": "Mozilla/5.0 (Linux; U; Android 4.0.4; zh-CN; BIRD T900 Build/MocorDroid4.0.4) AppleWebKit/534.31 (KHTML, like Gecko) UCBrowser/9.2.3.324 U3/0.8.0 Mobile Safari/534.31"
    },
    "device": {
      "deviceName": "T900",
      "marketingName": "T900",
      "manufacturer": "bird",
      "brand": "bird",
      "display": {
        "width": 480,
        "height": 320,
        "touch": true,
        "size": null
      },
      "type": "smartphone"
    },
    "browser": {
      "name": "UC Browser",
      "modus": null,
      "version": "9.2.3.324",
      "manufacturer": "ucweb",
      "bits": 32,
      "type": "transcoder"
    },
    "os": {
      "name": "Android",
      "marketingName": "Android",
      "version": "4.0.4",
      "manufacturer": "google",
      "bits": 32
    },
    "engine": {
      "name": "U3",
      "version": "0.8.0",
      "manufacturer": "ucweb"
    }
  },
  {
    "headers": {
      "user-agent": "Bird_T9108_TD/T9108_V1.00 Android/2.3.5 SC8810_CMCC/W12.06.10 Release/04.18.2012 Browser/AppleWebKit533.1"
    },
    "device": {
      "deviceName": "T9108",
      "marketingName": "T9108",
      "manufacturer": "bird",
      "brand": "bird",
      "display": {
        "width": 480,
        "height": 320,
        "touch": true,
        "size": null
      },
      "type": "smartphone"
    },
    "browser": {
      "name": "Darwin Browser",
      "modus": null,
      "version": "0.0.0",
      "manufacturer": "unknown",
      "bits": 32,
      "type": "browser"
    },
    "os": {
      "name": "Android",
      "marketingName": "Android",
      "version": "2.3.5",
      "manufacturer": "google",
      "bits": 32
    },
    "engine": {
      "name": "WebKit",
      "version": "533.1.0",
      "manufacturer": "apple"
    }
  },
  {
    "headers": {
      "user-agent": "Mozilla/5.0 (Linux; U; Android 4.0.3; fr-fr; BIRD-V8 Build/AD35) AppleWebKit/533.1 (KHTML, like Gecko) Version/4.0 Mobile Safari/533.1"
    },
    "device": {
      "deviceName": "V8",
      "marketingName": "V8",
      "manufacturer": "bird",
      "brand": "bird",
      "display": {
        "width": null,
        "height": null,
        "touch": true,
        "size": null
      },
      "type": "smartphone"
    },
    "browser": {
      "name": "Android Webkit",
      "modus": null,
      "version": "4.0.0",
      "manufacturer": "google",
      "bits": 32,
      "type": "browser"
    },
    "os": {
      "name": "Android",
      "marketingName": "Android",
      "version": "4.0.3",
      "manufacturer": "google",
      "bits": 32
    },
    "engine": {
      "name": "WebKit",
      "version": "533.1.0",
      "manufacturer": "apple"
    }
  },
  {
    "headers": {
      "user-agent": "Mozilla/5.0 (Linux; U; Android 4.2.2; en-us; BIRD_W5 Build/JDQ39) AppleWebKit/534.30 (KHTML, like Gecko) Version/4.0 Mobile Safari/534.30"
    },
    "device": {
      "deviceName": "W5",
      "marketingName": "W5",
      "manufacturer": "bird",
      "brand": "bird",
      "display": {
        "width": 480,
        "height": 320,
        "touch": true,
        "size": null
      },
      "type": "smartphone"
    },
    "browser": {
      "name": "Android Webkit",
      "modus": null,
      "version": "4.0.0",
      "manufacturer": "google",
      "bits": 32,
      "type": "browser"
    },
    "os": {
      "name": "Android",
      "marketingName": "Android",
      "version": "4.2.2",
      "manufacturer": "google",
      "bits": 32
    },
    "engine": {
      "name": "WebKit",
      "version": "534.30.0",
      "manufacturer": "apple"
    }
  },
  {
    "headers": {
      "user-agent": "Bird_T900/1.0 WindowsMobile/6.5 Release/12.1.2010 Browser/IE6 Profile/MIDP-2.0 Configuration/CLDC-1.1"
    },
    "device": {
      "deviceName": "T900",
      "marketingName": "T900",
      "manufacturer": "bird",
      "brand": "bird",
      "display": {
        "width": 480,
        "height": 320,
        "touch": true,
        "size": null
      },
      "type": "smartphone"
    },
    "browser": {
      "name": null,
      "modus": null,
      "version": "0.0.0",
      "manufacturer": "unknown",
      "bits": 32,
      "type": "unknown"
    },
    "os": {
      "name": "Android",
      "marketingName": "Android",
      "version": "0.0.0",
      "manufacturer": "google",
      "bits": 32
    },
    "engine": {
      "name": null,
      "version": "0.0.0",
      "manufacturer": "unknown"
    }
  }
]
