[
  {
    "headers": {
      "user-agent": "Mozilla/5.0 (Linux; U; Android 4.2.1; ru-ru; Turbo Pad 500 Build/JOP40D) AppleWebKit/534.30 (KHTML, like Gecko) Version/4.0 Mobile Safari/534.30 ACHEETAHI/2100501028"
    },
    "device": {
      "deviceName": "Pad 500",
      "marketingName": "Pad 500",
      "manufacturer": "TurboPad",
      "brand": "TurboPad",
      "display": {
        "width": 1280,
        "height": 720,
        "touch": true,
        "size": null
      },
      "type": "smartphone"
    },
    "browser": {
      "name": "CM Browser",
      "modus": null,
      "version": "0.0.0",
      "manufacturer": "CheetahMobile",
      "bits": 32,
      "type": "browser"
    },
    "os": {
      "name": "Android",
      "marketingName": "Android",
      "version": "4.2.1",
      "manufacturer": "Google",
      "bits": 32
    },
    "engine": {
      "name": "WebKit",
      "version": "534.30.0",
      "manufacturer": "Apple"
    }
  },
  {
    "headers": {
      "user-agent": "Mozilla/5.0 (Linux; U; Android 4.2.1; ru-ru; Turbo X6 Build/JOP40D) AppleWebKit/534.30 (KHTML, like Gecko) Version/4.0 Mobile Safari/534.30 ACHEETAHI/2100501028"
    },
    "device": {
      "deviceName": "Turbo X6",
      "marketingName": "Turbo X6",
      "manufacturer": "TurboPad",
      "brand": "TurboPad",
      "display": {
        "width": 1920,
        "height": 1080,
        "touch": true,
        "size": null
      },
      "type": "smartphone"
    },
    "browser": {
      "name": "CM Browser",
      "modus": null,
      "version": "0.0.0",
      "manufacturer": "CheetahMobile",
      "bits": 32,
      "type": "browser"
    },
    "os": {
      "name": "Android",
      "marketingName": "Android",
      "version": "4.2.1",
      "manufacturer": "Google",
      "bits": 32
    },
    "engine": {
      "name": "WebKit",
      "version": "534.30.0",
      "manufacturer": "Apple"
    }
  }
]
