[
  {
    "headers": {
      "user-agent": "Mozilla/5.0 (Linux; Android 4.4.2; ADVAN T1L Build/KOT49H) AppleWebKit/537.36 (KHTML, like Gecko) Version/4.0 Chrome/30.0.0.0 Mobile Safari/537.36"
    },
    "device": {
      "deviceName": "T1L",
      "marketingName": "T1L",
      "manufacturer": "advan",
      "brand": "advan",
      "display": {
        "width": 800,
        "height": 480,
        "touch": true,
        "size": null
      },
      "type": "tablet"
    },
    "browser": {
      "name": "Android WebView",
      "modus": null,
      "version": "30.0.0.0",
      "manufacturer": "google",
      "bits": 32,
      "type": "browser"
    },
    "os": {
      "name": "Android",
      "marketingName": "Android",
      "version": "4.4.2",
      "manufacturer": "google",
      "bits": 32
    },
    "engine": {
      "name": "Blink",
      "version": "537.36.0",
      "manufacturer": "google"
    }
  },
  {
    "headers": {
      "user-agent": "Mozilla/5.0 (Linux; U; Android 4.0.4; en-us; ANDROID T3i Build/IMM76D) AppleWebKit/534.30 (KHTML, like Gecko) Version/4.0 Mobile Safari/534.30"
    },
    "device": {
      "deviceName": "T3i",
      "marketingName": "Vandroid T3I",
      "manufacturer": "advan",
      "brand": "advan",
      "display": {
        "width": null,
        "height": null,
        "touch": true,
        "size": 9.7
      },
      "type": "tablet"
    },
    "browser": {
      "name": "Android Webkit",
      "modus": null,
      "version": "4.0.0",
      "manufacturer": "google",
      "bits": 32,
      "type": "browser"
    },
    "os": {
      "name": "Android",
      "marketingName": "Android",
      "version": "4.0.4",
      "manufacturer": "google",
      "bits": 32
    },
    "engine": {
      "name": "WebKit",
      "version": "534.30.0",
      "manufacturer": "apple"
    }
  }
]
