[
  {
    "headers": {
      "user-agent": "Mozilla/5.0 (Linux; Android 4.0.4; STARWAY Andromeda S925 3G Build/IMM76D) AppleWebKit/537.36 (KHTML, like Gecko) Chrome/38.0.2125.102 Safari/537.36 OPR/25.0.1619.84037"
    },
    "device": {
      "deviceName": "Andromeda S925 3G",
      "marketingName": "Andromeda S925 3G",
      "manufacturer": "star-way",
      "brand": "star-way",
      "display": {
        "width": 1024,
        "height": 768,
        "touch": true,
        "size": null
      },
      "type": "fone-pad"
    },
    "browser": {
      "name": "Opera Mobile",
      "modus": null,
      "version": "25.0.1619.84037",
      "manufacturer": "opera",
      "bits": null,
      "type": "browser"
    },
    "os": {
      "name": "Android",
      "marketingName": "Android",
      "version": "4.0.4",
      "manufacturer": "google",
      "bits": null
    },
    "engine": {
      "name": "Blink",
      "version": "537.36.0",
      "manufacturer": "google"
    }
  }
]
