[
  {
    "headers": {
      "user-agent": "Dalvik/2.1.0 (Linux## U## Android 5.1.1## XGIMI TV Build/LMY47V)"
    },
    "device": {
      "deviceName": "TV",
      "marketingName": "TV",
      "manufacturer": "XGIMI",
      "brand": "XGIMI",
      "display": {
        "width": null,
        "height": null,
        "touch": false,
        "size": null
      },
      "type": "tv-media-player"
    },
    "browser": {
      "name": "Dalvik",
      "modus": null,
      "version": "2.1.0",
      "manufacturer": "google",
      "bits": 32,
      "type": "application"
    },
    "os": {
      "name": "Android",
      "marketingName": "Android",
      "version": "5.1.1",
      "manufacturer": "google",
      "bits": 32
    },
    "engine": {
      "name": "WebKit",
      "version": "0.0.0",
      "manufacturer": "apple"
    }
  }
]
